{
  "$schema": "https://json-schema.org/draft/2020-12/schema",
  "$id": "https://contracts.wotaotao.com/events/commerce.review.reply-changed.v1/envelope.schema.json",
  "title": "ReviewReplyChanged envelope v1",
  "type": "object",
  "properties": {
    "eventId": {
      "type": "string",
      "minLength": 1,
      "description": "Stable evt_ identifier",
      "pattern": "^evt_[A-Za-z0-9_-]+$"
    },
    "eventType": {
      "type": "string",
      "const": "ReviewReplyChanged"
    },
    "schemaVersion": {
      "type": "integer",
      "const": 1
    },
    "occurredAt": {
      "type": "string",
      "format": "date-time",
      "description": "Business occurrence time"
    },
    "publishedAt": {
      "type": "string",
      "format": "date-time",
      "description": "Outbox publication time"
    },
    "producer": {
      "type": "string",
      "const": "SYS-02"
    },
    "environment": {
      "type": "string",
      "enum": [
        "DEV",
        "TEST",
        "STAGING",
        "PROD"
      ]
    },
    "audience": {
      "type": "array",
      "items": {
        "type": "string",
        "enum": [
          "SYS-03",
          "SYS-06"
        ]
      },
      "minItems": 1,
      "uniqueItems": true
    },
    "enterpriseId": {
      "anyOf": [
        {
          "type": "string",
          "minLength": 1,
          "description": "Stable ent_ identifier",
          "pattern": "^ent_[A-Za-z0-9_-]+$"
        },
        {
          "type": "null"
        }
      ]
    },
    "aggregateType": {
      "type": "string",
      "const": "Review"
    },
    "aggregateId": {
      "type": "string",
      "minLength": 1,
      "description": "Stable aggregate identifier"
    },
    "aggregateVersion": {
      "type": "integer",
      "minimum": 1,
      "description": "Monotonic aggregate version"
    },
    "traceId": {
      "type": "string",
      "minLength": 1
    },
    "causationId": {
      "anyOf": [
        {
          "type": "string",
          "minLength": 1,
          "description": "Stable evt_ identifier",
          "pattern": "^evt_[A-Za-z0-9_-]+$"
        },
        {
          "type": "null"
        }
      ]
    },
    "correlationId": {
      "type": "string",
      "minLength": 1
    },
    "idempotencyKey": {
      "type": "string",
      "minLength": 1,
      "description": "Stable business idempotency key; unchanged on retry"
    },
    "payload": {
      "type": "object",
      "properties": {
        "reviewId": {
          "type": "string",
          "minLength": 1,
          "description": "Stable rev_ identifier",
          "pattern": "^rev_[A-Za-z0-9_-]+$"
        },
        "enterpriseId": {
          "type": "string",
          "minLength": 1,
          "description": "Stable ent_ identifier",
          "pattern": "^ent_[A-Za-z0-9_-]+$"
        },
        "storeId": {
          "type": "string",
          "minLength": 1,
          "description": "Stable store_ identifier",
          "pattern": "^store_[A-Za-z0-9_-]+$"
        },
        "replyVersion": {
          "type": "integer",
          "minimum": 1,
          "description": "Monotonically increasing source version"
        },
        "publicReply": {
          "type": "string",
          "minLength": 1,
          "description": "Moderated public reply"
        },
        "status": {
          "type": "string",
          "enum": [
            "PUBLIC",
            "HIDDEN"
          ]
        },
        "changedAt": {
          "type": "string",
          "format": "date-time"
        }
      },
      "required": [
        "reviewId",
        "enterpriseId",
        "storeId",
        "replyVersion",
        "publicReply",
        "status",
        "changedAt"
      ],
      "additionalProperties": false,
      "$schema": "https://json-schema.org/draft/2020-12/schema",
      "$id": "https://contracts.wotaotao.com/events/commerce.review.reply-changed.v1/payload.schema.json",
      "title": "ReviewReplyChanged payload v1"
    }
  },
  "required": [
    "eventId",
    "eventType",
    "schemaVersion",
    "occurredAt",
    "publishedAt",
    "producer",
    "environment",
    "audience",
    "enterpriseId",
    "aggregateType",
    "aggregateId",
    "aggregateVersion",
    "traceId",
    "causationId",
    "correlationId",
    "idempotencyKey",
    "payload"
  ],
  "additionalProperties": false,
  "description": "reviewId + replyVersion; old replies remain immutable",
  "examples": [
    {
      "eventId": "evt_reviewreplychanged_001",
      "eventType": "ReviewReplyChanged",
      "schemaVersion": 1,
      "occurredAt": "2026-08-10T02:00:00Z",
      "publishedAt": "2026-08-10T02:00:01Z",
      "producer": "SYS-02",
      "environment": "DEV",
      "audience": [
        "SYS-03",
        "SYS-06"
      ],
      "enterpriseId": "ent_contract_001",
      "aggregateType": "Review",
      "aggregateId": "rev_contract_001",
      "aggregateVersion": 1,
      "traceId": "trace_contract_fixture_001",
      "causationId": null,
      "correlationId": "corr_contract_fixture_001",
      "idempotencyKey": "REVIEW_REPLY:rev_contract_001:1",
      "payload": {
        "reviewId": "rev_contract_001",
        "enterpriseId": "ent_contract_001",
        "storeId": "store_contract_001",
        "replyVersion": 1,
        "publicReply": "感谢反馈，我们会持续改进。",
        "status": "PUBLIC",
        "changedAt": "2026-08-10T02:00:00Z"
      }
    }
  ],
  "x-topic": "commerce.review.reply-changed.v1",
  "x-producer": "SYS-02",
  "x-consumers": [
    "SYS-03",
    "SYS-06"
  ],
  "x-idempotency-key-format": "REVIEW_REPLY:{reviewId}:{replyVersion}"
}
