{
  "eventId": "evt_reviewreplychanged_001",
  "eventType": "ReviewReplyChanged",
  "schemaVersion": 1,
  "occurredAt": "2026-08-10T02:00:00Z",
  "publishedAt": "2026-08-10T02:00:01Z",
  "producer": "SYS-02",
  "environment": "DEV",
  "audience": [
    "SYS-03",
    "SYS-06"
  ],
  "enterpriseId": "ent_contract_001",
  "aggregateType": "Review",
  "aggregateId": "rev_contract_001",
  "aggregateVersion": 1,
  "traceId": "trace_contract_fixture_001",
  "causationId": null,
  "correlationId": "corr_contract_fixture_001",
  "idempotencyKey": "REVIEW_REPLY:rev_contract_001:1",
  "payload": {
    "reviewId": "rev_contract_001",
    "enterpriseId": "ent_contract_001",
    "storeId": "store_contract_001",
    "replyVersion": 1,
    "publicReply": "感谢反馈，我们会持续改进。",
    "status": "PUBLIC",
    "changedAt": "2026-08-10T02:00:00Z"
  }
}
